{
  "review_id": "review-governed-identities-pilot-2026-08-16",
  "batch_id": "PILOT-PROMOTION-2026-08-16",
  "record_ids": [
    "book-edition-BATCH-2026-002-001",
    "book-edition-BATCH-2026-002-002",
    "book-edition-BATCH-2026-002-003",
    "book-edition-BATCH-2026-002-005",
    "book-edition-BATCH-2026-002-006",
    "book-edition-BATCH-2026-002-007",
    "book-edition-BATCH-2026-002-008",
    "book-edition-BATCH-2026-002-009",
    "book-edition-BATCH-2026-002-010",
    "book-edition-BATCH-2026-002-011",
    "book-edition-BATCH-2026-002-014",
    "book-work-BATCH-2026-002-001",
    "book-work-BATCH-2026-002-002",
    "book-work-BATCH-2026-002-003",
    "book-work-BATCH-2026-002-004",
    "book-work-BATCH-2026-002-005",
    "book-work-BATCH-2026-002-006",
    "book-work-BATCH-2026-002-007",
    "book-work-BATCH-2026-002-009",
    "person-BATCH-2026-002-001",
    "person-BATCH-2026-002-002",
    "person-BATCH-2026-002-003",
    "person-BATCH-2026-002-004",
    "person-BATCH-2026-002-005",
    "person-BATCH-2026-002-006",
    "person-BATCH-2026-002-007",
    "person-BATCH-2026-002-008",
    "person-BATCH-2026-002-009",
    "person-BATCH-2026-002-010",
    "person-BATCH-2026-002-011",
    "person-BATCH-2026-002-012",
    "person-BATCH-2026-002-013",
    "person-BATCH-2026-002-014",
    "person-BATCH-2026-002-015",
    "person-BATCH-2026-002-016",
    "person-BATCH-2026-002-017",
    "person-BATCH-2026-002-018",
    "person-BATCH-2026-002-019",
    "person-BATCH-2026-002-020",
    "person-BATCH-2026-002-021",
    "person-BATCH-2026-002-022",
    "person-BATCH-2026-002-023",
    "person-BATCH-2026-002-024",
    "person-BATCH-2026-002-025",
    "person-BATCH-2026-002-026",
    "person-BATCH-2026-002-027",
    "person-BATCH-2026-002-028",
    "person-BATCH-2026-002-029",
    "person-BATCH-2026-002-030",
    "person-BATCH-2026-005-alex-pentland",
    "person-BATCH-2026-005-daniel-kang",
    "person-BATCH-2026-005-edoardo-debenedetti",
    "person-BATCH-2026-005-florian-tramer",
    "person-BATCH-2026-005-hanrong-zhang",
    "person-BATCH-2026-005-jie-zhang",
    "person-BATCH-2026-005-jingyuan-huang",
    "person-BATCH-2026-005-kai-mei",
    "person-BATCH-2026-005-luca-beurer-kellner",
    "person-BATCH-2026-005-marc-fischer",
    "person-BATCH-2026-005-mislav-balunovic",
    "person-BATCH-2026-005-richard-fang",
    "person-BATCH-2026-005-tobin-south",
    "person-BATCH-2026-005-yongfeng-zhang",
    "person-BATCH-2026-005-yuxuan-zhu",
    "person-amy-shillinglaw",
    "person-jeff-steadman",
    "person-jim-mcdonald",
    "related-source-BATCH-2026-002-002",
    "related-source-BATCH-2026-002-003",
    "related-source-BATCH-2026-002-004",
    "related-source-BATCH-2026-002-005",
    "related-source-BATCH-2026-002-006",
    "related-source-BATCH-2026-002-007",
    "related-source-BATCH-2026-002-009",
    "related-source-BATCH-2026-002-010",
    "source-BATCH-2026-003-001",
    "source-BATCH-2026-003-002",
    "source-BATCH-2026-005-001",
    "source-BATCH-2026-005-002",
    "source-BATCH-2026-005-003",
    "source-BATCH-2026-005-004",
    "source-BATCH-2026-005-006",
    "source-BATCH-2026-005-007",
    "source-BATCH-2026-005-008",
    "source-BATCH-2026-005-009",
    "source-idac-390-agentic-ai-identity",
    "source-sailpoint-governing-ai-agents-2025",
    "statement-BATCH-2026-003-001",
    "statement-BATCH-2026-003-002",
    "statement-BATCH-2026-003-003",
    "statement-BATCH-2026-003-004",
    "statement-BATCH-2026-003-005",
    "statement-BATCH-2026-003-006",
    "statement-BATCH-2026-003-007",
    "statement-BATCH-2026-003-008",
    "statement-BATCH-2026-003-009",
    "statement-BATCH-2026-003-010",
    "statement-BATCH-2026-003-011",
    "statement-BATCH-2026-003-012",
    "statement-BATCH-2026-003-013",
    "statement-BATCH-2026-003-014",
    "statement-BATCH-2026-003-015",
    "statement-BATCH-2026-003-016",
    "statement-BATCH-2026-003-017",
    "statement-BATCH-2026-003-018",
    "statement-BATCH-2026-003-019",
    "statement-BATCH-2026-003-020",
    "statement-BATCH-2026-003-021",
    "statement-BATCH-2026-003-022",
    "statement-BATCH-2026-003-023",
    "statement-BATCH-2026-003-024",
    "statement-BATCH-2026-003-025",
    "statement-BATCH-2026-003-026",
    "statement-BATCH-2026-003-027",
    "statement-BATCH-2026-003-028",
    "statement-BATCH-2026-003-029",
    "statement-BATCH-2026-003-030",
    "statement-BATCH-2026-003-031",
    "statement-BATCH-2026-003-032",
    "statement-BATCH-2026-003-033",
    "statement-BATCH-2026-003-034",
    "statement-BATCH-2026-003-035",
    "statement-BATCH-2026-003-036",
    "statement-BATCH-2026-004-001",
    "statement-BATCH-2026-004-002",
    "statement-BATCH-2026-004-003",
    "statement-BATCH-2026-004-004",
    "statement-BATCH-2026-004-005",
    "statement-BATCH-2026-004-006",
    "statement-BATCH-2026-004-007",
    "statement-BATCH-2026-004-008",
    "statement-BATCH-2026-004-009",
    "statement-BATCH-2026-004-010",
    "statement-BATCH-2026-004-011",
    "statement-BATCH-2026-004-012",
    "statement-BATCH-2026-004-013",
    "statement-BATCH-2026-004-014",
    "statement-BATCH-2026-004-015",
    "statement-BATCH-2026-004-016",
    "statement-BATCH-2026-004-017",
    "statement-BATCH-2026-004-018",
    "statement-BATCH-2026-006-001",
    "statement-BATCH-2026-006-002",
    "statement-BATCH-2026-006-003",
    "statement-BATCH-2026-006-004",
    "statement-BATCH-2026-006-005",
    "statement-BATCH-2026-006-006",
    "statement-BATCH-2026-006-007",
    "statement-BATCH-2026-006-008",
    "statement-BATCH-2026-006-009",
    "statement-BATCH-2026-006-010",
    "statement-BATCH-2026-006-011",
    "statement-BATCH-2026-006-012",
    "statement-BATCH-2026-006-013",
    "statement-BATCH-2026-006-014",
    "statement-BATCH-2026-006-015",
    "statement-BATCH-2026-006-016",
    "statement-BATCH-2026-006-017",
    "statement-BATCH-2026-006-018",
    "statement-BATCH-2026-006-019",
    "statement-BATCH-2026-006-020",
    "statement-BATCH-2026-006-021",
    "statement-BATCH-2026-006-022",
    "statement-BATCH-2026-006-023",
    "statement-BATCH-2026-006-024",
    "statement-BATCH-2026-006-025",
    "statement-BATCH-2026-006-026",
    "statement-BATCH-2026-006-027",
    "statement-BATCH-2026-006-028",
    "statement-BATCH-2026-006-029",
    "statement-BATCH-2026-006-030",
    "statement-BATCH-2026-006-031",
    "statement-BATCH-2026-006-032",
    "statement-BATCH-2026-006-033",
    "statement-BATCH-2026-006-034",
    "statement-BATCH-2026-006-035",
    "statement-BATCH-2026-006-036",
    "statement-BATCH-2026-006-037",
    "statement-BATCH-2026-006-038",
    "statement-BATCH-2026-006-039",
    "statement-BATCH-2026-006-040",
    "statement-BATCH-2026-006-041",
    "statement-BATCH-2026-006-042",
    "statement-BATCH-2026-006-043",
    "statement-BATCH-2026-006-044",
    "statement-BATCH-2026-006-045",
    "statement-BATCH-2026-006-046"
  ],
  "review_type": "named_human_pilot_promotion_review",
  "reviewer_type": "human",
  "named_human_reviewer": "Murray Newlands",
  "review_date": "2026-08-16",
  "decisions": [
    {
      "decision": "APPROVE PILOT PROMOTION",
      "approval_url": "https://github.com/OpenFutureForum/executive-intelligence-index/issues/18#issuecomment-5310177421",
      "included_batch_ids": [
        "BUILD-2026-08-14-001",
        "BATCH-2026-001",
        "BATCH-2026-002",
        "BATCH-2026-003",
        "BATCH-2026-004",
        "BATCH-2026-005",
        "BATCH-2026-006",
        "BATCH-2026-007"
      ]
    }
  ],
  "corrections": [],
  "disagreements": [],
  "unresolved_issues": [],
  "rights_review": {
    "decision": "approved_link_and_paraphrase_only",
    "excluded_material": [
      "third-party full text",
      "extensive quotations",
      "transcripts",
      "figures",
      "tables",
      "private information"
    ]
  },
  "publication_recommendation": "approved_for_pilot_publication_with_recorded_exclusions_and_limitations",
  "workflow_status": "published",
  "machine_review_status": "ready_for_human_review",
  "human_review_status": "approved",
  "reviewed_by": "Murray Newlands",
  "reviewed_at": "2026-08-16T23:17:22Z",
  "provenance": [
    {
      "source_url": "https://github.com/OpenFutureForum/executive-intelligence-index/issues/18#issuecomment-5310177421",
      "accessed_at": "2026-08-16",
      "retrieval_method": "named human approval recorded in the repository issue tracker",
      "exact_locator": "Comment containing APPROVE PILOT PROMOTION",
      "content_hash": null,
      "batch_id": "PILOT-PROMOTION-2026-08-16",
      "prompt_id": "OEII-HUMAN-REVIEW-PROMOTION",
      "prompt_version": "1.0",
      "notes": "Approval is limited to the exact record IDs in this review record."
    }
  ],
  "revision_history": [
    {
      "changed_at": "2026-08-16T23:17:22Z",
      "changed_by": "Murray Newlands",
      "summary": "Approved for the governed-identities pilot release under the exact scope, exclusions, rights treatment, and limitations recorded in issue #18.",
      "batch_id": "PILOT-PROMOTION-2026-08-16"
    }
  ]
}
